{
  "id": "11000000-0000-4000-8000-000000000013",
  "type": "cellarbridge.fulfillment.public-milestone-reached.v1",
  "specVersion": "1.0",
  "occurredAt": "2026-07-20T10:20:00Z",
  "tenantId": "10000000-0000-4000-8000-000000000001",
  "producer": "fulfillment",
  "subject": { "type": "FULFILLMENT_PLAN", "id": "71000000-0000-4000-8000-000000000001", "number": "FUL-202607-000001" },
  "correlationId": "31000000-0000-4000-8000-000000000001",
  "causationId": "11000000-0000-4000-8000-000000000003",
  "payload": {
    "planId": "71000000-0000-4000-8000-000000000001",
    "planNumber": "FUL-202607-000001",
    "orderId": "51000000-0000-4000-8000-000000000001",
    "orderNumber": "ORD-202607-000001",
    "code": "ORDER_CONFIRMATION",
    "label": "Order confirmation",
    "occurredAt": "2026-07-20T10:20:00Z"
  }
}
