{
  "id": "11000000-0000-4000-8000-000000000010",
  "type": "cellarbridge.settlement.payment-reversed.v1",
  "specVersion": "1.0",
  "occurredAt": "2026-08-21T09:00:00Z",
  "tenantId": "10000000-0000-4000-8000-000000000001",
  "producer": "settlement",
  "subject": { "type": "RECEIVABLE", "id": "91000000-0000-4000-8000-000000000001", "number": "REC-202607-000001" },
  "correlationId": "31000000-0000-4000-8000-000000000001",
  "causationId": "93000000-0000-4000-8000-000000000001",
  "payload": {
    "receivableId": "91000000-0000-4000-8000-000000000001",
    "receivableNumber": "REC-202607-000001",
    "orderId": "51000000-0000-4000-8000-000000000001",
    "orderNumber": "ORD-202607-000001",
    "paymentId": "92000000-0000-4000-8000-000000000001",
    "reversalId": "93000000-0000-4000-8000-000000000001",
    "amount": "10000.0000",
    "currency": "CNY",
    "safeReason": "Duplicate bank statement entry",
    "reversedAt": "2026-08-21T09:00:00Z",
    "actorId": "11200000-0000-4000-8000-000000000008",
    "outstandingAmount": "88400.0000",
    "receivableStatus": "PARTIALLY_PAID"
  }
}
