{
  "id": "11000000-0000-4000-8000-000000000006",
  "type": "cellarbridge.fulfillment.completed.v1",
  "specVersion": "1.0",
  "occurredAt": "2026-07-20T10:16:00Z",
  "tenantId": "10000000-0000-4000-8000-000000000001",
  "producer": "fulfillment",
  "subject": {
    "type": "FULFILLMENT_PLAN",
    "id": "71000000-0000-4000-8000-000000000001",
    "number": "FUL-202607-000001"
  },
  "correlationId": "31000000-0000-4000-8000-000000000001",
  "causationId": "11000000-0000-4000-8000-000000000001",
  "payload": {
    "planId": "71000000-0000-4000-8000-000000000001",
    "planNumber": "FUL-202607-000001",
    "orderId": "51000000-0000-4000-8000-000000000001",
    "orderNumber": "ORD-202607-000001",
    "routeCode": "NB_BONDED_B2B",
    "completedAt": "2026-08-14T09:00:00Z",
    "publicMilestones": [
      {
        "code": "DISPATCHED",
        "label": "Order dispatched",
        "occurredAt": "2026-08-12T08:00:00Z"
      },
      {
        "code": "DELIVERED",
        "label": "Order delivered",
        "occurredAt": "2026-08-14T09:00:00Z"
      }
    ]
  }
}
