{
  "id": "11000000-0000-4000-8000-000000000012",
  "type": "cellarbridge.order.created.v1",
  "specVersion": "1.0",
  "occurredAt": "2026-07-20T10:16:00Z",
  "tenantId": "10000000-0000-4000-8000-000000000001",
  "producer": "trade-order",
  "subject": {
    "type": "TRADE_ORDER",
    "id": "51000000-0000-4000-8000-000000000011",
    "number": "ORD-202607-000011"
  },
  "correlationId": "31000000-0000-4000-8000-000000000011",
  "causationId": "11000000-0000-4000-8000-000000000011",
  "payload": {
    "orderId": "51000000-0000-4000-8000-000000000011",
    "orderNumber": "ORD-202607-000011",
    "sourceQuotationId": "21000000-0000-4000-8000-000000000001",
    "sourceRevisionId": "22000000-0000-4000-8000-000000000001",
    "sourceQuotationNumber": "QUO-202607-000001",
    "sourceRevision": 1,
    "sourceOwnerId": "11200000-0000-4000-8000-000000000003",
    "sourceEventId": "11000000-0000-4000-8000-000000000011",
    "acceptanceId": "23000000-0000-4000-8000-000000000001",
    "acceptedAt": "2026-07-20T10:15:30Z",
    "customer": {
      "partnerId": "24000000-0000-4000-8000-000000000001",
      "partnerNumber": "PAR-202607-000001",
      "displayName": "Jincheng Hospitality Group (synthetic)",
      "sourceVersion": 3
    },
    "currency": "CNY",
    "totalAmount": "128400.00",
    "paymentTermDays": 30,
    "acceptedTermsVersion": "TERMS-2026-01",
    "requestedDeliveryDate": "2026-08-15",
    "deliveryAddress": {
      "countryCode": "CN",
      "province": "Shanghai",
      "city": "Shanghai",
      "district": "Pudong",
      "line1": "88 Harbor Avenue",
      "postalCode": "200120"
    },
    "route": {
      "code": "NB_BONDED_B2B",
      "policyVersion": "TRP-2026-01",
      "estimatedDeliveryDate": "2026-08-15"
    },
    "snapshotHash": "a61b70c8847bbc58e64fa9d3dacdcf1277868166ea2c6af5762e89a010a96fad",
    "lines": [
      {
        "orderLineId": "52000000-0000-4000-8000-000000000011",
        "sourceQuotationLineId": "25000000-0000-4000-8000-000000000001",
        "skuId": "26000000-0000-4000-8000-000000000001",
        "skuCode": "CB-BDX-2019-750X6",
        "description": "Bordeaux Blend 2019 750ml x 6 (synthetic)",
        "quantity": "20",
        "unit": "CASE",
        "netUnitPrice": "6420.00",
        "lineTotal": "128400.00",
        "supplyPoolId": "27000000-0000-4000-8000-000000000001",
        "supplyType": "BONDED_ON_HAND"
      }
    ],
    "createdAt": "2026-07-20T10:16:00Z"
  }
}
