{
  "id": "11000000-0000-4000-8000-000000000011",
  "type": "cellarbridge.partner.submitted-for-review.v1",
  "specVersion": "1.0",
  "occurredAt": "2026-07-22T10:00:00Z",
  "tenantId": "10000000-0000-4000-8000-000000000001",
  "producer": "partner",
  "subject": {
    "type": "PARTNER",
    "id": "21000000-0000-4000-8000-000000000011",
    "number": "PAR-202607-000011"
  },
  "correlationId": "21000000-0000-4000-8000-000000000011",
  "causationId": "11200000-0000-4000-8000-000000000004",
  "payload": {
    "partnerId": "21000000-0000-4000-8000-000000000011",
    "number": "PAR-202607-000011",
    "submittedBy": "11200000-0000-4000-8000-000000000004"
  }
}
